{
  "schema_version": "skyrim-tool-adapter-v1",
  "adapter_id": "presentmon",
  "tool": "PresentMon process-scoped frame capture",
  "source": "https://github.com/GameTechDev/PresentMon",
  "targets": [
    "skyrim-se-ae",
    "vr-1.4.15"
  ],
  "capabilities": [
    "frame-time",
    "cpu-frame",
    "gpu-frame",
    "display-latency",
    "csv-capture",
    "frame-summary"
  ],
  "invocation": {
    "mode": "cli",
    "executable": "python",
    "arguments_template": [
      "tools/skyrim_mod_factory/run_presentmon_capture.py",
      "--presentmon",
      "{presentmon_executable}",
      "--process-id",
      "{process_id}",
      "--output-csv",
      "{trace_csv}",
      "--summary",
      "{summary_json}",
      "--execute"
    ],
    "transport": "local PresentMon console application",
    "requires_running_game": true
  },
  "inputs": [
    "running Skyrim process id",
    "PresentMon executable"
  ],
  "outputs": [
    "PresentMon CSV",
    "skyrim-frame-trace-summary-v1"
  ],
  "logs": [
    "PresentMon stderr"
  ],
  "coverage": {
    "description": "Process-scoped PresentMon capture using current documented CLI switches with deterministic per-PID CSV summarization.",
    "known_gaps": [
      "frame summaries are evidence, not automatic performance budgets unless the runtime test declares performance assertions",
      "hardware telemetry requires PresentMon/platform support beyond the baseline",
      "real Windows/MO2 qualification is still required before release-gate trust"
    ],
    "denominator_probe": "target-process frames captured and summarized from the produced CSV."
  },
  "safety": {
    "mutation_default": "new-output",
    "supports_dry_run": true,
    "supports_readback": true,
    "supports_undo": true,
    "sandbox_or_scope": "Capture is scoped to the fresh runtime process id; stale output CSV is removed before execution."
  },
  "verification": {
    "independent_validators": [
      "PresentMon CSV ProcessID column",
      "runtime session health pid",
      "performance assertion thresholds"
    ],
    "version_probe": "PresentMon --help/version plus source-pinned CLI grammar",
    "output_readback": "Composite MO2+DevBench sessions can launch PresentMon against the fresh DevBench-reported game PID; require target-PID rows and a usable frame-time metric before G20 evidence can pass."
  },
  "ai": {
    "typed_tooling": true,
    "schema_discovery": true,
    "provider_neutral": true,
    "context_cost_notes": "Turns raw frame CSV into compact typed evidence for runtime gates."
  },
  "evidence": {
    "source_url": "https://github.com/GameTechDev/PresentMon/blob/main/README-ConsoleApplication.md",
    "verified_date": "2026-09-25",
    "notes": "Current upstream documents --process_id, --output_file, --v2_metrics, --timed, --terminate_on_proc_exit and --terminate_after_timed."
  }
}
